{
  "schema_version": "2.0.0",
  "tenant_id": "018f1e2d-3c4b-7a01-8c9d-001122334455",
  "session_id": "018f1e2d-3c4b-7a02-8c9d-001122334456",
  "workflow_run_id": "018f1e2d-3c4b-7a15-8c9d-001122334465",
  "command_id": "018f1e2d-3c4b-7a10-8c9d-001122334460",
  "source_event_id": "018f1e2d-3c4b-7a11-8c9d-001122334461",
  "step": "generate_summary",
  "attempt": 1,
  "outcome": "checkpointed",
  "artifact_hash": "dddddddddddddddddddddddddddddddddddddddddddddddddddddddddddddddd",
  "failure_code": null,
  "trace_id": "11111111111111112222222222222222",
  "correlation_id": "018f1e2d-3c4b-7a12-8c9d-001122334462",
  "started_at": "2026-07-15T12:00:00Z",
  "completed_at": "2026-07-15T12:00:01Z",
  "data_classification": "internal"
}
